<?xml version="1.0" encoding="UTF-8"?>
<xs:schema xmlns:xs="http://www.w3.org/2001/XMLSchema" elementFormDefault="qualified">

  <!-- Root element -->
  <xs:element name="hospital">
    <xs:complexType>
      <xs:sequence>
        <xs:element name="patient" maxOccurs="unbounded">
          <xs:complexType>
            <xs:sequence>
              <!-- Name Details -->
              <xs:element name="name">
                <xs:complexType>
                  <xs:sequence>
                    <xs:element name="first" type="xs:string"/>
                    <xs:element name="middle" type="xs:string" minOccurs="0"/>
                    <xs:element name="last" type="xs:string"/>
                  </xs:sequence>
                </xs:complexType>
              </xs:element>

              <!-- Doctor Name -->
              <xs:element name="doctor" type="xs:string"/>

              <!-- Diseases (Multiple) -->
              <xs:element name="diseases">
                <xs:complexType>
                  <xs:sequence>
                    <xs:element name="disease" type="xs:string" maxOccurs="unbounded"/>
                  </xs:sequence>
                </xs:complexType>
              </xs:element>

              <!-- Consultation Charge -->
              <xs:element name="consultationCharge">
                <xs:simpleType>
                  <xs:restriction base="xs:decimal">
                    <xs:minInclusive value="500"/>
                    <xs:maxInclusive value="5000"/>
                  </xs:restriction>
                </xs:simpleType>
              </xs:element>

              <!-- Lab Tests (Multiple) -->
              <xs:element name="labTests">
                <xs:complexType>
                  <xs:sequence>
                    <xs:element name="test" type="xs:string" maxOccurs="unbounded"/>
                  </xs:sequence>
                </xs:complexType>
              </xs:element>
            </xs:sequence>

            <!-- Patient number as attribute (5-digit only) -->
            <xs:attribute name="patientNo">
              <xs:simpleType>
                <xs:restriction base="xs:string">
                  <xs:pattern value="\d{5}"/>
                </xs:restriction>
              </xs:simpleType>
            </xs:attribute>
          </xs:complexType>
        </xs:element>
      </xs:sequence>
    </xs:complexType>
  </xs:element>
</xs:schema>