<?xml version="1.0" encoding="UTF-8"?>
<hospital xmlns:xsi="http://www.w3.org/2001/XMLSchema-instance" xsi:noNamespaceSchemaLocation="Q.no.13.xsd">

  <patient patientNo="12345">
    <name>
      <first>John</first>
      <middle>A</middle>
      <last>Doe</last>
    </name>
    <doctor>Dr. Smith</doctor>
    <diseases>
      <disease>Fever</disease>
      <disease>Cough</disease>
    </diseases>
    <consultationCharge>1200</consultationCharge>
    <labTests>
      <test>Blood Test</test>
      <test>X-Ray</test>
    </labTests>
  </patient>

  <patient patientNo="67890">
    <name>
      <first>Mary</first>
      <last>Lee</last>
    </name>
    <doctor>Dr. Adams</doctor>
    <diseases>
      <disease>Diabetes</disease>
    </diseases>
    <consultationCharge>2500</consultationCharge>
    <labTests>
      <test>Glucose Test</test>
    </labTests>
  </patient>

</hospital>